{
    "version":  1,
    "updated_at":  "2025-08-29T23:23:03Z",
    "agents":  {
                   "operator":  {
                                    "name":  "AgentMode",
                                    "heartbeat":  "2025-08-29T23:23:03Z",
                                    "status":  "working",
                                    "last_note":  "Claim plan-issue"
                                },
                   "codex":  {
                                 "name":  "Codex",
                                 "heartbeat":  null,
                                 "status":  "idle",
                                 "last_note":  ""
                             }
               },
    "work_items":  [
                       {
                           "id":  "plan-issue",
                           "title":  "Open planning issue + checklist",
                           "owner":  "AgentMode",
                           "state":  "in_progress",
                           "pr":  null,
                           "artifacts":  [

                                         ],
                           "notes":  [
                                         "2025-08-29T23:23:03Z AgentMode: starting planning issue"
                                     ]
                       },
                       {
                           "id":  "build-script",
                           "title":  "Add tools/build/build_vs2022.ps1 with export checks",
                           "owner":  null,
                           "state":  "queued",
                           "pr":  null,
                           "artifacts":  [

                                         ],
                           "notes":  [

                                     ]
                       },
                       {
                           "id":  "sync-script",
                           "title":  "Add tools/dev/sync_to_gmod.ps1 and backup flow",
                           "owner":  null,
                           "state":  "queued",
                           "pr":  null,
                           "artifacts":  [

                                         ],
                           "notes":  [

                                     ]
                       },
                       {
                           "id":  "ci-workflow",
                           "title":  "Add .github/workflows/win-build.yml (artifacts uploaded)",
                           "owner":  null,
                           "state":  "queued",
                           "pr":  null,
                           "artifacts":  [

                                         ],
                           "notes":  [

                                     ]
                       },
                       {
                           "id":  "release-workflow",
                           "title":  "Add .github/workflows/win-release.yml (tagged release + checksums)",
                           "owner":  null,
                           "state":  "queued",
                           "pr":  null,
                           "artifacts":  [

                                         ],
                           "notes":  [

                                     ]
                       },
                       {
                           "id":  "docs",
                           "title":  "Update README Quickstart + add CONTRIBUTING + CHANGELOG",
                           "owner":  null,
                           "state":  "queued",
                           "pr":  null,
                           "artifacts":  [

                                         ],
                           "notes":  [

                                     ]
                       },
                       {
                           "id":  "version-bump",
                           "title":  "Tag next version and publish release",
                           "owner":  null,
                           "state":  "queued",
                           "pr":  null,
                           "artifacts":  [

                                         ],
                           "notes":  [

                                     ]
                       }
                   ]
}
